UC1:

mysql> create database AddressBookService;
Query OK, 1 row affected (0.02 sec)

mysql> show databases;
+--------------------+
| Database           |
+--------------------+
| addressbookdb      |
| addressbookservice |
| adressbookdb       |
| alpha              |
| information_schema |
| mysql              |
| payroll_service    |
| performance_schema |
| sys                |
+--------------------+
9 rows in set (0.00 sec)
------------------------------------------------------------------------------------------------------------------------------------------------------

UC2:

mysql> CREATE TABLE Contact(FirstName varchar(30), LastName varchar(30), Address varchar(50), City varchar(50), Zip int, PhoneNumber int, Email varchar(50));
Query OK, 0 rows affected (0.07 sec)

mysql> desc Contact;
+-------------+-------------+------+-----+---------+-------+
| Field       | Type        | Null | Key | Default | Extra |
+-------------+-------------+------+-----+---------+-------+
| FirstName   | varchar(30) | YES  |     | NULL    |       |
| LastName    | varchar(30) | YES  |     | NULL    |       |
| Address     | varchar(50) | YES  |     | NULL    |       |
| City        | varchar(50) | YES  |     | NULL    |       |
| Zip         | int         | YES  |     | NULL    |       |
| PhoneNumber | int         | YES  |     | NULL    |       |
| Email       | varchar(50) | YES  |     | NULL    |       |
+-------------+-------------+------+-----+---------+-------+
7 rows in set (0.02 sec)

--------------------------------------------------------------------------------------------------------------------------------------------------

UC3:

mysql> INSERT INTO Contact VALUES("Moinuddin", "Asraf", "Mansarovar", "Jaipur", 123456, 123123, "moin@gmail.com");
Query OK, 1 row affected (0.02 sec)

---------------------------------------------------------------------------------------------------------------------------------------------------

UC4:

mysql> UPDATE Contact SET Address = "NY" where FirstName = "Moinuddin";
Query OK, 1 row affected (0.01 sec)
Rows matched: 1  Changed: 1  Warnings: 0

mysql> select * from Contact;
+-----------+----------+---------+--------+--------+-------------+----------------+
| FirstName | LastName | Address | City   | Zip    | PhoneNumber | Email          |
+-----------+----------+---------+--------+--------+-------------+----------------+
| Moinuddin | Asraf    | NY      | Jaipur | 123456 |      123123 | moin@gmail.com |
+-----------+----------+---------+--------+--------+-------------+----------------+
1 row in set (0.00 sec)
--------------------------------------------------------------------------------------------------------------------------------------------------

UC5:

mysql> delete from Contact where FirstName = "Moinuddin";
Query OK, 1 row affected (0.01 sec)

mysql> select * from Contact;
Empty set (0.00 sec)

---------------------------------------------------------------------------------------------------------------------------------------------------

UC6:

mysql> select * from Contact where city = "Jaipur" or Zip = 123456;
+-----------+----------+------------+--------+--------+-------------+----------------+
| FirstName | LastName | Address    | City   | Zip    | PhoneNumber | Email          |
+-----------+----------+------------+--------+--------+-------------+----------------+
| Moinuddin | Asraf    | Mansarovar | Jaipur | 123456 |      123123 | moin@gmail.com |
+-----------+----------+------------+--------+--------+-------------+----------------+
1 row in set (0.00 sec)

----------------------------------------------------------------------------------------------------------------------------------------------------

UC7:
mysql> SELECT COUNT(City) FROM Contact GROUP BY City;
+-------------+
| COUNT(City) |
+-------------+
|           1 |
+-------------+
1 row in set (0.00 sec)

----------------------------------------------------------------------------------------------------------------------------------------------------

UC8:
mysql> SELECT FirstName, LastName, City from Contact ORDER BY FirstName;
+-----------+----------+--------+
| FirstName | LastName | City   |
+-----------+----------+--------+
| Akshay    | Singh    | Mumbai |
| Moinuddin | Asraf    | Jaipur |
| Pranav    | Shinde   | Pune   |
+-----------+----------+--------+
3 rows in set (0.00 sec)

---------------------------------------------------------------------------------------------------------------------------------------------------

UC9:

mysql> ALTER TABLE Contact ADD Type varchar(30);
Query OK, 0 rows affected (0.07 sec)
Records: 0  Duplicates: 0  Warnings: 0

mysql> desc Contact;
+-------------+-------------+------+-----+---------+-------+
| Field       | Type        | Null | Key | Default | Extra |
+-------------+-------------+------+-----+---------+-------+
| FirstName   | varchar(30) | YES  |     | NULL    |       |
| LastName    | varchar(30) | YES  |     | NULL    |       |
| Address     | varchar(50) | YES  |     | NULL    |       |
| City        | varchar(50) | YES  |     | NULL    |       |
| Zip         | int         | YES  |     | NULL    |       |
| PhoneNumber | int         | YES  |     | NULL    |       |
| Email       | varchar(50) | YES  |     | NULL    |       |
| Type        | varchar(30) | YES  |     | NULL    |       |
+-------------+-------------+------+-----+---------+-------+
8 rows in set (0.01 sec)

mysql> UPDATE Contact SET Type="Friends" WHERE FirstName="Pranav";
Query OK, 1 row affected (0.01 sec)
Rows matched: 1  Changed: 1  Warnings: 0

mysql> select * from Contact;
+-----------+----------+------------+--------+--------+-------------+------------------+---------+
| FirstName | LastName | Address    | City   | Zip    | PhoneNumber | Email            | Type    |
+-----------+----------+------------+--------+--------+-------------+------------------+---------+
| Moinuddin | Asraf    | Mansarovar | Jaipur | 123456 |      123123 | moin@gmail.com   | NULL    |
| Pranav    | Shinde   | Paradise   | Pune   |  44232 |   975467281 | pranav@gmail.com | Friends |
| Akshay    | Singh    | Avenue     | Mumbai |  40231 |    93846128 | akshay@gmail.com | NULL    |
+-----------+----------+------------+--------+--------+-------------+------------------+---------+
3 rows in set (0.00 sec)

----------------------------------------------------------------------------------------------------------------------------------------------

UC10:

mysql> SELECT COUNT(*) FROM Contact GROUP BY Type;
+----------+
| COUNT(*) |
+----------+
|        2 |
|        1 |
+----------+
2 rows in set (0.00 sec)
